title,link,description,bloggername,bloggerlink,postdate
하남 스타필드 팝업 전기자전거 체험 행사 핀스쿠터/후트... ,https://blog.naver.com/vnlffltm/223837733316,"어린이 자전거까지 전 연령층이 함께 즐길 수 있는 구성이더라고요! 가족 단위로 구경 오시기에도 좋을 것 같고, 어린이날 선물 미리 준비하시는 분들께도 딱이겠죠? 사실 전기자전거나 전기스쿠터는... ",SWEET B 하루,blog.naver.com/vnlffltm,20250418
전기자전거 사용 시 주의 사항 체크 안전하고 오래 타는 법!,https://blog.naver.com/haruday1/223855753356,"전기자전거는 &quot;기계&quot;가 아니라 &quot;생활&quot; 단순히 자전거 + 전기모터의 조합이 아니다. 우리 일상 속을 바꾸는 스마트한 모빌리티 기기가 됐다. 제대로 알고 타면, -&gt; 출퇴근 시간은 줄이고 -&gt; 운동은 되고 -&gt; 교통비도... ",하루(春)같은 하루,blog.naver.com/haruday1,20250506
전기자전거 구매가이드 배터리부터 모터 출력까지!,https://blog.naver.com/rlfehdud/223844821273,"심장 전기자전거는 배터리가 생명입니다. 용량이 충분해야 장거리 주행이 가능하고, 충전 효율도 좋아야 스트레스가 없죠. 용량 단위 Wh(와트시) / Ah(암페어시) 기준 수치 일반 도심형 자전거는 최소 400Wh... ",평범한 아빠의 아마추어선수 도전기,blog.naver.com/rlfehdud,20250425
카고 전기자전거 미니벨로 대명사 턴 킥 하울 p9,https://blog.naver.com/jun0457/223825382800,"로드 자전거와 전기자전거 관련한 이야기가 많은 것이 사실입니다 아무래도 그런 관련 정보를 많이... 시에는 전기 공급이 되지 않는다는 이야기입니다 옵션으로 앞, 뒤 짐받이를 장착하고 그 외에 다양한... ",좋은생각황병준,blog.naver.com/jun0457,20250407
배달용 전기자전거 추천 면허 배터리 팝업 행사 정보,https://blog.naver.com/me_my_bass/223838917727,"그래서 눈을 돌린 게 '전기자전거'였습니다. 면허가 필요 없고, 부담 없이 시작할 수 있다는 게 가장... 전기스쿠터인데도 오토바이처럼 부담스럽지 않고, 자전거처럼 어렵지 않게 탈 수 있어서 초보자도... ",하루에 한번쯤,blog.naver.com/me_my_bass,20250418
