title,originallink,link,description,pubDate
"&quot;클로드로 업무 대체&quot;…클라우드플레어, 기업용 AI 연결 인프라 확대",https://zdnet.co.kr/view/?no=20250507134611,https://n.news.naver.com/mnews/article/092/0002373306?sid=105,통해 다양한 고객 환경에 맞춘 통합 기능을 빠르게 제공할 수 있게 됐다&quot;고 말했다. 프라카 메흐로트라 페이팔 AI 부문 수석부사장은 &quot;개발자들이 자연어 지시만으로 결제 처리나 환불 자동화가 가능해졌다&quot;고 설명했다.,"Wed, 07 May 2025 14:15:00 +0900"
[AI의 역사] 43 지식을 표현하고 개념을 체계화하는 연구 - 시맨틱 네트...,https://www.aitimes.com/news/articleView.html?idxno=170201,https://www.aitimes.com/news/articleView.html?idxno=170201,"시맨틱 네트워크는 기계 번역과 같은 자연어 처리를 위한 목적으로도 많이 활용됐고, 복잡한 분류나 인과 관계를 갖는 추론에 자연스러운 표현이 가능해서 지식 표현에도 많이 활용됐다. 다만, 링크들의 의미가... ","Wed, 07 May 2025 12:00:00 +0900"
"마이크로소프트, AI 중심의 서피스 코파일럿 플러스 신제품으로 개인용...",https://www.aitimes.kr/news/articleView.html?idxno=34834,https://www.aitimes.kr/news/articleView.html?idxno=34834,"기기들은 스냅드래곤 엑스 플러스(Snapdragon X Plus) 프로세서와 초당 45조 연산을 처리하는 신경처리장치(NPU)... 기능은 자연어 기반 입력을 통해 문서, 이미지, 앱을 효율적으로 탐색할 수 있도록 지원한다. 곧 적용... ","Wed, 07 May 2025 11:02:00 +0900"
"클라우드플레어, 글로벌 테크 기업과 협업",https://www.venturesquare.net/967643,https://www.venturesquare.net/967643,"클라우드플레어상에 구축된 페이팔의 MCP 서버를 통해 개발자들은 자연어로 AI 에이전트에게 지시해 재고 관리, 결제 처리, 배송 추적, 환불 처리 등을 자동화할 수 있게... ","Wed, 07 May 2025 10:57:00 +0900"
"[더벨]아너스운용, 미국 휴머노이드 기업 '피규어AI' 투자",https://www.thebell.co.kr/free/content/ArticleView.asp?key=202504240956118560101474,https://www.thebell.co.kr/free/content/ArticleView.asp?key=202504240956118560101474,데이터를 처리하는 시간 차를 대폭 줄인 새로운 휴머노이드 로봇용 기계학습(머신러닝) 모델 '헬릭스'를 공개하며 세간의 이목을 끌었다. 당시 피규어AI는 &quot;강력한 객체 일반화를 통해 자연어로 말만 해도 다양한... ,"Wed, 07 May 2025 10:38:00 +0900"
